<?xml version="1.0" encoding="UTF-8"?>

<!--
VNUML Root Scenario (1)
See the tutorial/index.html document for details
-->

<vnx xmlns:xsi="http://www.w3.org/2001/XMLSchema-instance"
  xsi:noNamespaceSchemaLocation="/usr/share/xml/vnx/vnx-1.92.xsd">
  <global>
    <version>1.92</version>
    <scenario_name>tutorial-r1_xp_vnx</scenario_name>
    <automac/>
    <vm_mgmt type="private" network="10.250.0.0" mask="24">
       <host_mapping />
    </vm_mgmt> 
    <vm_defaults exec_mode="mconsole">
       <filesystem type="cow">/usr/share/vnx/filesystems/root_fs_tutorial</filesystem>
       <mem>64M</mem>
       <kernel>/usr/share/vnx/kernels/linux</kernel>
       <console id="0">xterm</console>
       <!--xterm>gnome-terminal,-t,-x</xterm-->
    </vm_defaults>
  </global>

  <net name="Net0" mode="virtual_bridge" />
  <net name="Net1" mode="virtual_bridge" />
  <net name="Net2" mode="virtual_bridge" />
  <net name="Net3" mode="virtual_bridge" />

  <vm name="uml1" type="libvirt" subtype="kvm" os="linux">
    <filesystem type="cow">/usr/share/vnx/filesystems/root_fs_linux</filesystem>
    <mem>256M</mem>
    <if id="1" net="Net0">
      <ipv4>10.0.0.1</ipv4>
    </if>
    <route type="ipv4" gw="10.0.0.3">default</route>
    <exec seq="start" type="verbatim">nohup /usr/bin/hello &lt;/dev/null &gt;/dev/null 2&gt;&amp;1 &amp;</exec>
    <exec seq="stop" type="verbatim">killall hello</exec> 
  </vm>

  <vm name="uml2" type="libvirt" subtype="kvm" os="linux">
    <filesystem type="cow">/usr/share/vnx/filesystems/root_fs_linux</filesystem>
    <mem>256M</mem>
    <if id="1" net="Net2">
      <ipv4>10.0.2.8</ipv4>
    </if>
    <route type="ipv4" gw="10.0.2.1">default</route>
    <filetree seq="arbol" root="/home/vnx/Desktop/">/home/jorge/workspace/dhcp</filetree>
    <exec seq="calc" type="verbatim" mode="system">gcalctool</exec>
    <exec seq="killcalc" type="verbatim" mode="mconsole">pkill gcalctool</exec>
    <exec seq="holas" type="verbatim" mode="system">touch /home/vnx/Desktop/hola_system</exec>
    <exec seq="holan" type="verbatim" mode="processn">touch /home/vnx/Desktop/hola_processn</exec>
    <exec seq="holay" type="verbatim" mode="processy">touch /home/vnx/Desktop/hola_processy</exec>
    <exec seq="ping" type="verbatim" mode="system">'ping 10.0.2.2'</exec>
    <exec seq="showlog" type="verbatim" mode="system">'while true; do cat /var/log/vnxdaemon.log;sleep 3;clear; done'</exec>
  </vm>

  <vm name="uml3" type="libvirt" subtype="kvm" os="windows">
    <filesystem type="cow">/usr/share/vnx/filesystems/root_fs_winxp</filesystem>
    <mem>256M</mem>
    <if id="1" net="Net0">
      <ipv4>10.0.0.2</ipv4>
    </if>
    <route type="ipv4" gw="10.0.0.3">default</route>
    <exec seq="dir" type="verbatim">dir </exec>
    <exec seq="logout" type="verbatim">shutdown -l</exec>
    <exec seq="reboot" type="verbatim">shutdown -r</exec>
    <exec seq="calc" type="verbatim" mode="system">calc.exe</exec>
    <exec seq="deg" type="verbatim">shutdown -a</exec>
  </vm>

  <vm name="uml4" type="libvirt" subtype="kvm" os="linux">
  <filesystem type="cow">/usr/share/vnx/filesystems/root_fs_linux</filesystem>
  <mem>256M</mem>
    <if id="1" net="Net0">
      <ipv4>10.0.0.3</ipv4>
    </if>
    <if id="2" net="Net1">
      <ipv4>10.0.1.1</ipv4>
    </if>
    <if id="3" net="Net3">
      <ipv4>10.0.3.1</ipv4>
    </if>
    <route type="ipv4" gw="10.0.1.2">10.0.2.0/24</route>
    <forwarding type="ip" />
    <filetree seq="arbol" root="/home/vnx/Desktop">/home/jorge/Desktop/origen</filetree>
    <exec seq="showlog" type="verbatim" mode="system">'while true; do cat /var/log/vnxdaemon.log;sleep 3;clear; done'</exec>
    <exec seq="calc" type="verbatim" mode="system">gcalctool</exec>
    <exec seq="killcalc" type="verbatim" mode="system">pkill gcalctool</exec>
    <exec seq="firefox" type="verbatim" mode="system">firefox</exec>
    <exec seq="term" type="verbatim" mode="processy">gnome-terminal</exec>
  </vm>

  <vm name="uml5" type="uml" subtype="" os="">
    <if id="1" net="Net1">
      <ipv4>10.0.1.2</ipv4>
    </if>
    <if id="2" net="Net2">
      <ipv4>10.0.2.1</ipv4>
    </if>
    <route type="ipv4" gw="10.0.1.1">default</route>
    <forwarding type="ip" />
  </vm>

  <vm name="uml6" type="uml" subtype="" os="">
    <if id="1" net="Net2">
      <ipv4>10.0.2.2</ipv4>
    </if>
    <route type="ipv4" gw="10.0.2.1">default</route>
  </vm>
  


  <host>
    <hostif net="Net3">
       <ipv4>10.0.3.2</ipv4>
    </hostif>
    <route type="ipv4" gw="10.0.3.1">10.0.0.0/16</route>
  </host>

</vnx>
